,Unnamed: 0,ID,ProdID,Rating,ReviewCount,Category,Brand,Name,ImageURL,Description,Tags
254,258,5,421,4.3,1213.0,"beauty, hair, care, hair, care, brands, clairol",clairol,"Hertzko Double-Sided Dog and Cat Dematting Comb: Pet Grooming Tool for Removing Loose Undercoat, Mats, and Tangled Hair - Doodle Dematting Comb, Self-Cleaning (Purple)",https://m.media-amazon.com/images/I/71VUX4xmLNL._SL1500_.jpg,"old, feel, applies, hair, want, hair, tell, story, way, 100, advanced, gray, coverage, clairol, age, defy, permanent, hair, color, intensifying, pre, treat, serum, antioxidant, infused, colorseal, conditioning, therapy, clairol, age, defy, expertly, designed, cover, stubborn, grays, hair, looks, younger, plus, includes, innovative, tri, plex, formula, help, protect, hair, structure, reduce, hair, breakage, wait, live, hair, looks, 10, years, younger, thanks, clairol, age, defy, advanced, coverage, stubborn, grays, innovative, tri, plex, formula, helps, protect, hair, structure, reduce, hair, breakage, includes, intensifying, pre, treat, serum, antioxidant, infused, colorseal, conditioning, therapy, 100, advanced, gray, coverage","beauty, hair, care, hair, care, brands, clairol, clairol, old, feel, applies, hair, want, hair, tell, story, way, 100, advanced, gray, coverage, clairol, age, defy, permanent, hair, color, intensifying, pre, treat, serum, antioxidant, infused, colorseal, conditioning, therapy, clairol, age, defy, expertly, designed, cover, stubborn, grays, hair, looks, younger, plus, includes, innovative, tri, plex, formula, help, protect, hair, structure, reduce, hair, breakage, wait, live, hair, looks, 10, years, younger, thanks, clairol, age, defy, advanced, coverage, stubborn, grays, innovative, tri, plex, formula, helps, protect, hair, structure, reduce, hair, breakage, includes, intensifying, pre, treat, serum, antioxidant, infused, colorseal, conditioning, therapy, 100, advanced, gray, coverage"
255,259,9,8,0.0,0.0,"health, vitamins, supplements, supplements","navitas, organics",Madelaine Premium Solid Milk Chocolate Christmas Mini Santa & Elves - Wrapped In Italian Foil - For Goodie Bags & Candy Jars - Contains One Pound,https://m.media-amazon.com/images/I/61bVjg1gjJL._SL1000_.jpg,"navitas, organics, maca, gelatinized, powder, 8, oz, bag, organic, non, gmo, gluten, free, brand, navitas, organics, manufacturer, navitas, naturals, model, 12, 003, size, 8, ounce, adaptogen, maca, helps, balance, stress, levels, bolster, resiliency, body, navitas, organics, gelatinized, maca, powder, heat, processed, remove, starch, maca, allowing, easier, digestion, sweet, malty, maca, powder, delicious, smoothies, warm, drinks, oatmeal, baked, goods, usda, organic, kosher, non, gmo, vegan, gluten, free, maca, potent, superfood, root, andes, mountains, peru, indigenous, andean, societies, source, nourishment, healing, thousands, years, navitas, naturals, gelatinized, maca, powder, concentrated, form, extracting, starch, makes, nutrition, easier, digest, absorb, nutty, butterscotch, flavor, brand, navitas, organics, manufacturer, navitas, naturals, model, 12, 003, size, 8, ounce, adaptogen, maca, helps, balance, stress, levels, bolster, resiliency, body, navitas, organics, gelatinized, maca, powder, heat, processed, remove, starch, maca, allowing, easier, digestion, sweet, malty, maca, powder, delicious, smoothies, warm, drinks, oatmeal, baked, goods","health, vitamins, supplements, supplements, navitas, organics, navitas, organics, maca, gelatinized, powder, 8, oz, bag, organic, non, gmo, gluten, free, brand, navitas, organics, manufacturer, navitas, naturals, model, 12, 003, size, 8, ounce, adaptogen, maca, helps, balance, stress, levels, bolster, resiliency, body, navitas, organics, gelatinized, maca, powder, heat, processed, remove, starch, maca, allowing, easier, digestion, sweet, malty, maca, powder, delicious, smoothies, warm, drinks, oatmeal, baked, goods, usda, organic, kosher, non, gmo, vegan, gluten, free, maca, potent, superfood, root, andes, mountains, peru, indigenous, andean, societies, source, nourishment, healing, thousands, years, navitas, naturals, gelatinized, maca, powder, concentrated, form, extracting, starch, makes, nutrition, easier, digest, absorb, nutty, butterscotch, flavor, brand, navitas, organics, manufacturer, navitas, naturals, model, 12, 003, size, 8, ounce, adaptogen, maca, helps, balance, stress, levels, bolster, resiliency, body, navitas, organics, gelatinized, maca, powder, heat, processed, remove, starch, maca, allowing, easier, digestion, sweet, malty, maca, powder, delicious, smoothies, warm, drinks, oatmeal, baked, goods"
256,260,206,3,0.0,3.0,"health, aromatherapy, essential, oils, essential, oils",,"Butternut Mountain Farm Pure Vermont Maple Syrup, Grade A, Amber Color, Rich Taste, All Natural, Easy Pour Jug, 32 Fl Oz, 1 Qt",https://m.media-amazon.com/images/I/71DzFP8VfFL._SL1500_.jpg,"foods, 1, fl, oz, spearmint, oil, pack, 2, benefits, cooling, invigorating, stimulating, mixes, bergamot, oil, lavender, oil, lime, oil, rosemary, oil, extraction, method, steam, distilled, leaves, flowering, tops, purity, quality, assured","health, aromatherapy, essential, oils, essential, oils, , foods, 1, fl, oz, spearmint, oil, pack, 2, benefits, cooling, invigorating, stimulating, mixes, bergamot, oil, lavender, oil, lime, oil, rosemary, oil, extraction, method, steam, distilled, leaves, flowering, tops, purity, quality, assured"
257,261,43,18,0.0,0.0,"personal, care, oral, care, toothbrushes, electric, toothbrushes, oral, b, electric, toothbrushes","oral, b",Epson Artisan 1430 Wireless Color Wide-Format Inkjet Printer (C11CB53201),https://m.media-amazon.com/images/I/61BlZ95frSL._AC_SL1300_.jpg,"oral, b, eb50, 6, crossaction, bristle, protection, technology, replacement, brush, heads, 6, 300, plaque, gum, lineour, advanced, brush, head, perfectly, angled, bristles, reach, deep, teeth, removes, 300, plaque, gum, line, vs, regular, manual, bristles, provide, precise, cleanoral, b, crossaction, toothbrush, head, features, bristles, set, 16, degree, angle, effectively, clean, gumline, bristles, reach, deep, teeth, lift, power, away, 100, plaque, vs, regular, feature, indicatororal, b, brush, head, refills, feature, indicator, bristles, fade, halfway, help, remind, replace, toothbrush, head, maintain, superior, clean, following, model, d5015, t, d5021s, d5025t, d5045s, d5525, t, clean, duo, floss, action, ic2522, kids, precision, clean, genius, pro, white, ultra, quot, quot","personal, care, oral, care, toothbrushes, electric, toothbrushes, oral, b, electric, toothbrushes, oral, b, oral, b, eb50, 6, crossaction, bristle, protection, technology, replacement, brush, heads, 6, 300, plaque, gum, lineour, advanced, brush, head, perfectly, angled, bristles, reach, deep, teeth, removes, 300, plaque, gum, line, vs, regular, manual, bristles, provide, precise, cleanoral, b, crossaction, toothbrush, head, features, bristles, set, 16, degree, angle, effectively, clean, gumline, bristles, reach, deep, teeth, lift, power, away, 100, plaque, vs, regular, feature, indicatororal, b, brush, head, refills, feature, indicator, bristles, fade, halfway, help, remind, replace, toothbrush, head, maintain, superior, clean, following, model, d5015, t, d5021s, d5025t, d5045s, d5525, t, clean, duo, floss, action, ic2522, kids, precision, clean, genius, pro, white, ultra, quot, quot"
258,262,673,6,0.0,72.0,"personal, care, bath, body, loofahs, bath, sponges, accessories",ecotools,"TruRoots Organic Sprouted Mung Beans, Certified USDA Organic, Non-GMO Project Verified, 10 Ounces (Pack of 6)",https://m.media-amazon.com/images/I/71mH2lXmZEL._SL1500_.jpg,"exfoliating, ecopouf, designed, textured, recycled, netting, remove, dead, skin, cells, deep, clean, recycled, netting, deep, exfoliation, cruelty, free, love, furry, friends, products, peta, certified, meaning, 100, cruelty, free, vegan, tree, free, packaging, 100, tree, free, paper, 20, cotton, 80, bamboo, fibers","personal, care, bath, body, loofahs, bath, sponges, accessories, ecotools, exfoliating, ecopouf, designed, textured, recycled, netting, remove, dead, skin, cells, deep, clean, recycled, netting, deep, exfoliation, cruelty, free, love, furry, friends, products, peta, certified, meaning, 100, cruelty, free, vegan, tree, free, packaging, 100, tree, free, paper, 20, cotton, 80, bamboo, fibers"
259,263,2,99,0.0,0.0,"seasonal, stock, essentials, personal, care, stock, stock, oral, care",colgate,"Neenah Index Cardstock, 8.5"" x 11"", 90 lb/163 gsm, White, Lightweight, 94 Brightness, 300 Sheets (91437)",https://m.media-amazon.com/images/I/81hjsUgSXbL._AC_SL1500_.jpg,"colgate, total, sf, advanced, whitening, toothpaste, breakthrough, formula, fights, bacteria, teeth, tongue, cheeks, gums, mouth, health, colgate, total, stannous, fluoride, offers, benefits, including, sensitivity, relief, improved, enamel, strength, odor, neutralization, based, vitro, studies, breakthrough, formula, stain, removal, prevention, beautiful, smile, fights, bacteria, teeth, tongue, cheeks, gums, mouth, health, whitening, toothpaste, helps, remove, surface, stains, helps, prevent, plaque, tartar, cavities, gingivitis, relief, sensitive, teeth, paste, toothpaste, formula","seasonal, stock, essentials, personal, care, stock, stock, oral, care, colgate, colgate, total, sf, advanced, whitening, toothpaste, breakthrough, formula, fights, bacteria, teeth, tongue, cheeks, gums, mouth, health, colgate, total, stannous, fluoride, offers, benefits, including, sensitivity, relief, improved, enamel, strength, odor, neutralization, based, vitro, studies, breakthrough, formula, stain, removal, prevention, beautiful, smile, fights, bacteria, teeth, tongue, cheeks, gums, mouth, health, whitening, toothpaste, helps, remove, surface, stains, helps, prevent, plaque, tartar, cavities, gingivitis, relief, sensitive, teeth, paste, toothpaste, formula"
260,264,72,3,4.6,336.0,"personal, care, oral, care, toothbrushes, manual, toothbrushes, colgate, toothbrushes",colgate,"Amazon Basics Multi-Angle Portable Stand for iPad Tablet, E-reader and Phone - Silver",https://m.media-amazon.com/images/I/61CgHKyRyqL._AC_SL1500_.jpg,"colgate, 360⁰, adult, head, toothbrush, designed, medium, cleaning, bristles, polishing, cups, help, remove, plaque, stains, ordinary, flat, trim, toothbrush, manual, toothbrush, ergonomic, handle, design, unique, cheek, tongue, cleaner, helps, reduce, 151, bacteria, cause, bad, breath, versus, brushing, teeth, ordinary, flat, trim, toothbrush, colgate, 360, toothbrush, tongue, cheek, cleaner, medium, 4, count, toothbrush, reduces, 151, bacteria, bacteria, cause, bad, breath, brushing, teeth, ordinary, flat, trim, toothbrush, cleaning, bristles, polishing, cups, help, remove, plaque, stains, cheek, tongue, cleaner, ergonomic, handle, design, healthier, mouth, clean, brushing, teeth, ordinary, flat, trim, toothbrush","personal, care, oral, care, toothbrushes, manual, toothbrushes, colgate, toothbrushes, colgate, colgate, 360⁰, adult, head, toothbrush, designed, medium, cleaning, bristles, polishing, cups, help, remove, plaque, stains, ordinary, flat, trim, toothbrush, manual, toothbrush, ergonomic, handle, design, unique, cheek, tongue, cleaner, helps, reduce, 151, bacteria, cause, bad, breath, versus, brushing, teeth, ordinary, flat, trim, toothbrush, colgate, 360, toothbrush, tongue, cheek, cleaner, medium, 4, count, toothbrush, reduces, 151, bacteria, bacteria, cause, bad, breath, brushing, teeth, ordinary, flat, trim, toothbrush, cleaning, bristles, polishing, cups, help, remove, plaque, stains, cheek, tongue, cleaner, ergonomic, handle, design, healthier, mouth, clean, brushing, teeth, ordinary, flat, trim, toothbrush"
261,265,5,1,0.0,0.0,"premium, beauty, premium, facial, skincare, premium, face, masks","pur, lisse","Stens New Spindle Assembly 285-851 Compatible with/Replacement for John Deere D100-D160, LA100-LA165, X110, X120 and X140 GX21694, GY20454, GY20867, GY20962, GY21098, M149625",https://m.media-amazon.com/images/I/61nVb235DxL._AC_SL1500_.jpg,,"premium, beauty, premium, facial, skincare, premium, face, masks, pur, lisse, "
262,266,18,1728,4.7,3.0,"premium, beauty, premium, facial, skincare, premium, face, cleansers","pca, skin","Jeylly Galaxy S6 Edge Plus Case, [3 Color] Slim Hybrid Impact Rugged Soft TPU & Hard PC Bumper Shockproof Protective Anti-Slip Case Cover Shell for Samsung Galaxy S6 Edge+ Plus G928 - Purple",https://m.media-amazon.com/images/I/61JuS07ij-L._AC_SL1500_.jpg,,"premium, beauty, premium, facial, skincare, premium, face, cleansers, pca, skin, "
263,267,5795,6,0.0,0.0,"food, condiments, sauces, spices, condiments, condiments","country, farms","Astrobrights Mega Collection, Colored Cardstock, Bright Teal, 320 Sheets, 65 lb/176 gsm, 8.5"" x 11"" - MORE SHEETS! (91695)",https://m.media-amazon.com/images/I/81LQgq1LypL._AC_SL1500_.jpg,"pack, 2, upc, 035046098513, product, description, apple, cider, vinegar, numerous, proteins, enzymes, friendly, bacteria, high, acetic, acid, content, helps, promote, weight, loss, satiety, proper, digestion, aids, detoxification, fluid, balance, available, delicious, tonic, convenient, capsules, brownish, colored, sedimentation, bottle, gives, vinegar, cloudy, web, like, appearance, bottle, shaken, organic, apple, cider, vinegar, numerous, proteins, enzymes, friendly, bacteria, high, acetic, acid, content, helps, promote, weight, loss, satiety, proper, digestion, aids, detoxification, fluid, balance, ginger, cayenne, maple, raw, unfiltered, active, brownish, colored, sedimentation, bottle, gives, vinegar, cloudy, web, like, appearance, bottle, shaken, 2, pack, country, farms, apple, cider, vinegar, organic, ginger, cayenne, maple, 16, oz","food, condiments, sauces, spices, condiments, condiments, country, farms, pack, 2, upc, 035046098513, product, description, apple, cider, vinegar, numerous, proteins, enzymes, friendly, bacteria, high, acetic, acid, content, helps, promote, weight, loss, satiety, proper, digestion, aids, detoxification, fluid, balance, available, delicious, tonic, convenient, capsules, brownish, colored, sedimentation, bottle, gives, vinegar, cloudy, web, like, appearance, bottle, shaken, organic, apple, cider, vinegar, numerous, proteins, enzymes, friendly, bacteria, high, acetic, acid, content, helps, promote, weight, loss, satiety, proper, digestion, aids, detoxification, fluid, balance, ginger, cayenne, maple, raw, unfiltered, active, brownish, colored, sedimentation, bottle, gives, vinegar, cloudy, web, like, appearance, bottle, shaken, 2, pack, country, farms, apple, cider, vinegar, organic, ginger, cayenne, maple, 16, oz"
264,268,3,66,4.1,644.0,"beauty, makeup, face, makeup, foundation, maybelline, foundation, deep, shades",maybelline,"PACON 4"" Self-Adhesive Uppercase and Lowercase Letters, 154-Count, White (51698)",https://m.media-amazon.com/images/I/71bjII846eL._AC_SL1500_.jpg,"gel, foundation, hydrates, skin, 12, hours, delivers, soft, matte, finish, velvet, smooth, perfection, drying, roughness, ideal, normal, combination, skin, soft, matte, hydrating, foundation, unique, gel, foundation, formula, provides, medium, coverage, gel, whipped, foundation, infused, water, apply, maybelline, dream, velvet, foundation, maybelline, dream, blender, ultimate, finish, soft, matte, hydrating, foundation, unique, gel, foundation, formula, provides, medium, coverage, gel, whipped, foundation, infused, water","beauty, makeup, face, makeup, foundation, maybelline, foundation, deep, shades, maybelline, gel, foundation, hydrates, skin, 12, hours, delivers, soft, matte, finish, velvet, smooth, perfection, drying, roughness, ideal, normal, combination, skin, soft, matte, hydrating, foundation, unique, gel, foundation, formula, provides, medium, coverage, gel, whipped, foundation, infused, water, apply, maybelline, dream, velvet, foundation, maybelline, dream, blender, ultimate, finish, soft, matte, hydrating, foundation, unique, gel, foundation, formula, provides, medium, coverage, gel, whipped, foundation, infused, water"
265,269,57,-2147483648,4.7,200.0,"personal, care, bath, body, body, wash, shower, gel",suave,Pioneer Pet Sticky Paws Furniture Strips Cat Deterrent,https://m.media-amazon.com/images/I/51fdybAfIiS._AC_SL1200_.jpg,"suave, naturals, sweet, pea, violet, body, wash, infused, sweet, pea, violet, extracts, skin, conditioning, vitamin, e, showers, gorgeously, feminine, scent, leaving, skin, fresh, delightfully, fragrant","personal, care, bath, body, body, wash, shower, gel, suave, suave, naturals, sweet, pea, violet, body, wash, infused, sweet, pea, violet, extracts, skin, conditioning, vitamin, e, showers, gorgeously, feminine, scent, leaving, skin, fresh, delightfully, fragrant"
266,270,324,67586476,0.0,8.0,"premium, beauty, premium, makeup, premium, face, premium, foundation",colorescience,"ANKER Powerline II Lightning Cable, [6ft MFi Certified] USB Charging/Sync Lightning Cord Compatible with iPhone SE 11 11 Pro 11 Pro Max Xs MAX XR X 8 7 6S 6 5, iPad and More",https://m.media-amazon.com/images/I/511YSGFPANS._SL1500_.jpg,,"premium, beauty, premium, makeup, premium, face, premium, foundation, colorescience, "
267,271,8422,4,4.9,246.0,"seasonal, stock, essentials, household, essentials, stock, stock, batteries",energizer,"HERSHEY'S Chocolate Candy Bar , 30 Count Crunchy Variety (HERSHEY'S, KIT KAT, REESE'S, and REESE'S Crispy Crunch)",https://m.media-amazon.com/images/I/81IOUsu2C-L._SL1500_.jpg,"count, long, lasting, power, device, shelf, energizer, max, 9v, alkaline, batteries, shelf, life, 5, years, storage, energizer, 9, volt, batteries, ready, need, energizer, batteries, fuel, technology, helps, live, smoke, detector, batteries, remote, control, devices, powerseal, technology, protects, leakage, better, leading, batteries, years, fully, left, low, drain, devices, trust, power, energizer, 9v, batteries, need, work, play, live, 8, pack, energizer, max, alkaline, 9v, batteries, long, lasting, batteries, dependable, power, 9, volt, devices, shelf, 9v, batteries, depend, smoke, detectors, safety, devices, hand, held, meters, backup, batteries, battery, pack, holds, power, 5, years, storage, energizer, 9, volt, alkaline, batteries, designed, protect, devices, damaging, leaks, years, fully, makers, energizer, bunny, 1, longest, lasting, aa, battery, energizer, ultimate, lithium, feel, confident, knowing, long, lasting, power, protection, expect, energizer","seasonal, stock, essentials, household, essentials, stock, stock, batteries, energizer, count, long, lasting, power, device, shelf, energizer, max, 9v, alkaline, batteries, shelf, life, 5, years, storage, energizer, 9, volt, batteries, ready, need, energizer, batteries, fuel, technology, helps, live, smoke, detector, batteries, remote, control, devices, powerseal, technology, protects, leakage, better, leading, batteries, years, fully, left, low, drain, devices, trust, power, energizer, 9v, batteries, need, work, play, live, 8, pack, energizer, max, alkaline, 9v, batteries, long, lasting, batteries, dependable, power, 9, volt, devices, shelf, 9v, batteries, depend, smoke, detectors, safety, devices, hand, held, meters, backup, batteries, battery, pack, holds, power, 5, years, storage, energizer, 9, volt, alkaline, batteries, designed, protect, devices, damaging, leaks, years, fully, makers, energizer, bunny, 1, longest, lasting, aa, battery, energizer, ultimate, lithium, feel, confident, knowing, long, lasting, power, protection, expect, energizer"
268,272,66764,19,4.3,23.0,"beauty, skin, care, skin, care, concern, skin, care, products, dry, skin",palmer,"Regency Wraps Butchers Cooking Twine, Heavy Duty, 500 ft,16 Ply, 2.4mm, Food-Safe Cotton Kitchen String for Turkey Trussing, Meat Prep, Crafting, Natural, Pack of 3",https://m.media-amazon.com/images/I/61NtVVBIBPL._AC_SL1100_.jpg,"pack, 6, upc, 010181040702, proven, formula, extraordinary, browneactive, ingredients, water, aqua, theobroma, cacao, cocoa, seed, butter, butyrospermum, parkii, shea, butter, sodium, polyacrylate, hydrogenated, polydecene, soluble, collagen, hydrolyzed, elastin, tocopheryl, acetate, palmitoyl, oligo, peptide, rahnella, soy, protein, ferment, glyceryl, polymethacrylate, glycerin, propylene, glycol, fragrance, parfum, benzyl, alcohol, dmdm, hydantoinuses, firm, tone, bust, pregnancy, weight, loss, specially, formulated, cream, smoothes, like, gel, unique, blend, pure, cocoa, butter, shea, butter, vitamin, e, maximizes, moisturization, collagen, elastin, proven, ingredients, help, restructure, elastic, fibers, increase, tone, firmness, dermatologically, tested, pack, 6, upc, 010181040702, proven, formula, extraordinary, browneactive, ingredients, water, aqua, theobroma, cacao, cocoa, seed, butter, butyrospermum, parkii, shea, butter, sodium, polyacrylate, hydrogenated, polydecene, soluble, collagen, hydrolyzed, elastin, tocopheryl, acetate, palmitoyl, oligo, peptide, rahnella, soy, protein, ferment, glyceryl, polymethacrylate, glycerin, propylene, glycol, fragrance, parfum, benzyl, alcohol, dmdm, hydantoin, uses, firm, tone, bust, pregnancy, weight, loss, specially, formulated, cream, smoothes, like, gel, unique, blend, pure, cocoa, butter, shea, butter, vitamin, e, maximizes, moisturization, collagen, elastin, proven, ingredients, help, restructure, elastic, fibers, increase, tone, firmness, dermatologically, tested","beauty, skin, care, skin, care, concern, skin, care, products, dry, skin, palmer, pack, 6, upc, 010181040702, proven, formula, extraordinary, browneactive, ingredients, water, aqua, theobroma, cacao, cocoa, seed, butter, butyrospermum, parkii, shea, butter, sodium, polyacrylate, hydrogenated, polydecene, soluble, collagen, hydrolyzed, elastin, tocopheryl, acetate, palmitoyl, oligo, peptide, rahnella, soy, protein, ferment, glyceryl, polymethacrylate, glycerin, propylene, glycol, fragrance, parfum, benzyl, alcohol, dmdm, hydantoinuses, firm, tone, bust, pregnancy, weight, loss, specially, formulated, cream, smoothes, like, gel, unique, blend, pure, cocoa, butter, shea, butter, vitamin, e, maximizes, moisturization, collagen, elastin, proven, ingredients, help, restructure, elastic, fibers, increase, tone, firmness, dermatologically, tested, pack, 6, upc, 010181040702, proven, formula, extraordinary, browneactive, ingredients, water, aqua, theobroma, cacao, cocoa, seed, butter, butyrospermum, parkii, shea, butter, sodium, polyacrylate, hydrogenated, polydecene, soluble, collagen, hydrolyzed, elastin, tocopheryl, acetate, palmitoyl, oligo, peptide, rahnella, soy, protein, ferment, glyceryl, polymethacrylate, glycerin, propylene, glycol, fragrance, parfum, benzyl, alcohol, dmdm, hydantoin, uses, firm, tone, bust, pregnancy, weight, loss, specially, formulated, cream, smoothes, like, gel, unique, blend, pure, cocoa, butter, shea, butter, vitamin, e, maximizes, moisturization, collagen, elastin, proven, ingredients, help, restructure, elastic, fibers, increase, tone, firmness, dermatologically, tested"
269,273,22,4,0.0,372.0,"household, essentials, cleaning, supplies, cleaning, tools, cleaning, refills",swiffer,"Chair Mat for Carpet- Low Pile, 46 by 60-Inch Rectangle, Clear Vinyl",https://m.media-amazon.com/images/I/811t8gXn+FL._AC_SL1500_.jpg,"swiffer, sweeper, multi, surface, dry, sweeping, cloth, refills, deep, textured, ridges, trap, lock, dirt, dust, hair, allergens, floors, clean, free, debris, use, swiffer, sweeper, swiffer, swiffer, trap, common, inanimate, allergens, cat, dog, dander, dust, mite, matter, swiffer, sweeper, dry, sweeping, cloth, refills, gain, scent, 32, count, deep, textured, ridges, trap, lock, dirt, dust, hair, allergens, common, inanimate, allergens, cat, dog, dander, dust, mite, matter, thick, dry, cloths, conform, surface, floors, grout, lines, great, picking, pet, hair, multi, surface, floor, types, hardwood, tile, vinyl, floors, use, swiffer, sweeper, swiffer, swiffer, trap, try, swiffer, sweeper, wet, mop, refills, ve, grabbed, dry, stuff, swiffer, sweeper, dry, cloths, remove, stuck, dirt, sweeper, wet, mop, cloths","household, essentials, cleaning, supplies, cleaning, tools, cleaning, refills, swiffer, swiffer, sweeper, multi, surface, dry, sweeping, cloth, refills, deep, textured, ridges, trap, lock, dirt, dust, hair, allergens, floors, clean, free, debris, use, swiffer, sweeper, swiffer, swiffer, trap, common, inanimate, allergens, cat, dog, dander, dust, mite, matter, swiffer, sweeper, dry, sweeping, cloth, refills, gain, scent, 32, count, deep, textured, ridges, trap, lock, dirt, dust, hair, allergens, common, inanimate, allergens, cat, dog, dander, dust, mite, matter, thick, dry, cloths, conform, surface, floors, grout, lines, great, picking, pet, hair, multi, surface, floor, types, hardwood, tile, vinyl, floors, use, swiffer, sweeper, swiffer, swiffer, trap, try, swiffer, sweeper, wet, mop, refills, ve, grabbed, dry, stuff, swiffer, sweeper, dry, cloths, remove, stuck, dirt, sweeper, wet, mop, cloths"
270,274,74597,95,4.6,7.0,"premium, beauty, premium, hair, care, hair, tools, premium, hair, scalp, treatments",nioxin,"DIBBATU Flirt Pole for Dogs Interactive Dog Toys for Large Medium Small Dogs Chase and Tug of War, Dog Teaser Wand with Lure Chewing Toy for Outdoor Exercise & Training",https://m.media-amazon.com/images/I/61lMG814iHL._AC_SL1500_.jpg,,"premium, beauty, premium, hair, care, hair, tools, premium, hair, scalp, treatments, nioxin, "
