,Unnamed: 0,ID,ProdID,Rating,ReviewCount,Category,Brand,Name,ImageURL,Description,Tags
383,392,34,16,4.8,214.0,"personal, care, oral, care, kids, oral, care",orajel,"Royal Canin Hair & Skin Care Dry Cat Food, 6 lb bag",https://m.media-amazon.com/images/I/711d8qF5p6L._AC_SL1500_.jpg,"believe, babies, develop, plaque, teeth, gums, baby, orajel, tooth, gum, cleanser, helps, gently, safely, remove, plaque, buildup, little, ones, mouth, fluoride, free, safe, swallowed, use, directed, free, alcohol, parabens, aspartame, dyes, sugar, sls, dairy, gluten, combo, pack, elmo, toothbrush, banana, apple, flavor, tastes, great, contain, artifical, colors, dyes","personal, care, oral, care, kids, oral, care, orajel, believe, babies, develop, plaque, teeth, gums, baby, orajel, tooth, gum, cleanser, helps, gently, safely, remove, plaque, buildup, little, ones, mouth, fluoride, free, safe, swallowed, use, directed, free, alcohol, parabens, aspartame, dyes, sugar, sls, dairy, gluten, combo, pack, elmo, toothbrush, banana, apple, flavor, tastes, great, contain, artifical, colors, dyes"
384,393,7244,8,0.0,0.0,"premium, beauty, premium, bath, body, premium, body, hair, removal",avon,"Pendaflex File Folders, Letter Size, 1/3 Cut, Manila, 100 per Box (752 1/3)",https://m.media-amazon.com/images/I/51H7vhBWPQL._AC_SL1500_.jpg,,"premium, beauty, premium, bath, body, premium, body, hair, removal, avon, "
385,394,31,1975639,4.7,327.0,,theraworx,"Fellowes Workstation File Organizer, 7 Section, Wire, Black (68112)",https://m.media-amazon.com/images/I/71YslSsaomL._AC_SL1500_.jpg,"theraworx, protects, newest, system, u, pak, clinically, proven, promote, daily, urinary, health, suffering, recurring, urinary, tract, features, daily, cleansing, support, menopausal, health, anal, cleansing, catheter, care, cleansing, sexual, intercourse",", theraworx, theraworx, protects, newest, system, u, pak, clinically, proven, promote, daily, urinary, health, suffering, recurring, urinary, tract, features, daily, cleansing, support, menopausal, health, anal, cleansing, catheter, care, cleansing, sexual, intercourse"
386,395,3556746,2,0.0,33.0,"personal, care, bath, body, body, scrubs, exfoliators",artnaturals,"Nylabone Puppy Chew Teething Pacifier - Puppy Chew Toy for Teething - Puppy Supplies - Bacon Flavor, Small/Regular (1 Count)",https://m.media-amazon.com/images/I/71y9ChQjJJL._AC_SL1500_.jpg,"skin, gorgeous, glow, premium, kona, coffee, extracts, gently, exfoliate, polish, skin, shines, natural, formula, daily, glow, face, body, global, journey, curate, global, collection, pure, essential, oils, discovering, finest, sources, world, enjoy, journey, jet, lag, peppermint, greece, lavender, bulgaria, rosemary, morocco, tea, tree, australia, frankincense, eucalyptus, india, artnaturals, strongly, believes, power, natural, senses, integrate, aromatherapy, essential, oils, growing, collection, naturally, focused, products, artnaturals, arabica, coffee, body, scrub, 20, oz, 567, g, skin, wake, pure, natural, arabica, coffee, scrub, gently, exfoliate, deeply, cleanse, bold, premium, arabic, kona, coffee, grounds, blended, luxurious, dead, sea, salt, invigorating, caffeine, compounds, pure, cacao, stimulate, circulation, help, tighten, skin, 100, natural, coffee, body, scrub, packed, antioxidants, deeply, hydrating, shea, butter, olive, oil, sweet, almond, oil, coconut, extract, nourish, protect, use, arabic, coffee, scrub, daily, buff, away, impurities, nourish, skin, reveal, softer, smoother, skin, help, improve, appearance, varicose, veins, cellulite, stretch, marks, swelling, puffiness, invigorating, aroma, boosts, daily, shower, routine, leaving, feel, awake, ready, day","personal, care, bath, body, body, scrubs, exfoliators, artnaturals, skin, gorgeous, glow, premium, kona, coffee, extracts, gently, exfoliate, polish, skin, shines, natural, formula, daily, glow, face, body, global, journey, curate, global, collection, pure, essential, oils, discovering, finest, sources, world, enjoy, journey, jet, lag, peppermint, greece, lavender, bulgaria, rosemary, morocco, tea, tree, australia, frankincense, eucalyptus, india, artnaturals, strongly, believes, power, natural, senses, integrate, aromatherapy, essential, oils, growing, collection, naturally, focused, products, artnaturals, arabica, coffee, body, scrub, 20, oz, 567, g, skin, wake, pure, natural, arabica, coffee, scrub, gently, exfoliate, deeply, cleanse, bold, premium, arabic, kona, coffee, grounds, blended, luxurious, dead, sea, salt, invigorating, caffeine, compounds, pure, cacao, stimulate, circulation, help, tighten, skin, 100, natural, coffee, body, scrub, packed, antioxidants, deeply, hydrating, shea, butter, olive, oil, sweet, almond, oil, coconut, extract, nourish, protect, use, arabic, coffee, scrub, daily, buff, away, impurities, nourish, skin, reveal, softer, smoother, skin, help, improve, appearance, varicose, veins, cellulite, stretch, marks, swelling, puffiness, invigorating, aroma, boosts, daily, shower, routine, leaving, feel, awake, ready, day"
387,396,7,753,0.0,10.0,"personal, care, bath, body, hand, soaps","jason, natural, products","Nylabone Puppy Chew Teething Pacifier - Puppy Chew Toy for Teething - Puppy Supplies - Bacon Flavor, Small/Regular (1 Count)",https://m.media-amazon.com/images/I/71y9ChQjJJL._AC_SL1500_.jpg,"jason, natural, products, 1x, 16, oz, satin, lavender, liquid, soap, soap, bottle, brings, incredible, moisture, renewal, system, olive, oil, vitamin, e, natural, fresh, scent, lavender, provence, soothing, comfort, aloe, vera, selected, botanical, extracts, liquid, soap, note, product, description, informational, check, actual, product, label, possession, accurate, ingredient, information, use, health, dietary, related, matter, consult, doctor, sku, bngla4452, 1959, soothes, nourishes, lavender, extract, vitamin, e, pro, vitamin, b5, leaping, bunny, certified, earth, friendly, biodegradable, formula","personal, care, bath, body, hand, soaps, jason, natural, products, jason, natural, products, 1x, 16, oz, satin, lavender, liquid, soap, soap, bottle, brings, incredible, moisture, renewal, system, olive, oil, vitamin, e, natural, fresh, scent, lavender, provence, soothing, comfort, aloe, vera, selected, botanical, extracts, liquid, soap, note, product, description, informational, check, actual, product, label, possession, accurate, ingredient, information, use, health, dietary, related, matter, consult, doctor, sku, bngla4452, 1959, soothes, nourishes, lavender, extract, vitamin, e, pro, vitamin, b5, leaping, bunny, certified, earth, friendly, biodegradable, formula"
388,398,9,4,3.9,19.0,"beauty, makeup, face, makeup, face, makeup, brands, iman, face, makeup","iman, cosmetics","Dog Halloween Costumes, Pet Deadly Doll Dog Costume Funny Dog Costumes Dog Halloween Costume Clothes for Small Medium Large Extra Large Dogs Pets (Medium)",https://m.media-amazon.com/images/I/81925GROwiL._AC_SL1500_.jpg,"skin, tone, evening, beauty, balm, spf, 15, combines, skin, care, sheer, hint, color, compliments, natural, tones, women, skin, color, iman, skin, tone, evener, complex, acai, licorice, grape, seed, kokum, almond, aloe, vitamins, c, fingertips, apply, small, product, cleansed, skin, tone, evener, bb, creme, evens, nourishes, hydrates, iman, skin, tone, evener, complex, paraben, free","beauty, makeup, face, makeup, face, makeup, brands, iman, face, makeup, iman, cosmetics, skin, tone, evening, beauty, balm, spf, 15, combines, skin, care, sheer, hint, color, compliments, natural, tones, women, skin, color, iman, skin, tone, evener, complex, acai, licorice, grape, seed, kokum, almond, aloe, vitamins, c, fingertips, apply, small, product, cleansed, skin, tone, evener, bb, creme, evens, nourishes, hydrates, iman, skin, tone, evener, complex, paraben, free"
389,399,891,0,4.6,8.0,"beauty, beauty, brands, sheamoisture, shea, moisture, facial, care",sheamoisture,"Parker 3016031PP QUINK Long Fountain Pen Ink Refill Cartridges, Blue, 5 Count",https://m.media-amazon.com/images/I/51CHX7buffL._AC_SL1500_.jpg,"shea, moisture, fruit, fusion, coconut, water, shea, butter, vegan, lip, balm, w, imbe, oil, aloe, replenishes, rejuvenates, dry, lips, moisturizing, certified, organic, shea, butter, refreshing, coconut, water, proprietary, fusion, dragon, fruit, lychee, berry, green, apple, imbe, oil, rich, antioxidant, vitamin, c, helps, revitalize, lips, protect, free, radicals, contains, parabens, phthalates, propylene, glycol, mineral, oil, sulfates, shea, moisture, fruit, fusion, coconut, water, shea, butter, vegan, lip, balm, w, imbe, oil, aloe, established, 1912, replenish, rejuvenate, 100, natural, fl, oz, 15, ml","beauty, beauty, brands, sheamoisture, shea, moisture, facial, care, sheamoisture, shea, moisture, fruit, fusion, coconut, water, shea, butter, vegan, lip, balm, w, imbe, oil, aloe, replenishes, rejuvenates, dry, lips, moisturizing, certified, organic, shea, butter, refreshing, coconut, water, proprietary, fusion, dragon, fruit, lychee, berry, green, apple, imbe, oil, rich, antioxidant, vitamin, c, helps, revitalize, lips, protect, free, radicals, contains, parabens, phthalates, propylene, glycol, mineral, oil, sulfates, shea, moisture, fruit, fusion, coconut, water, shea, butter, vegan, lip, balm, w, imbe, oil, aloe, established, 1912, replenish, rejuvenate, 100, natural, fl, oz, 15, ml"
390,400,5,4219088,0.0,421.0,"personal, care, bath, body, bar, soap",ivory,"Chef's Cut Smoked Beef and Pork Jerky Snack Sticks, Original Smokehouse, High Protein Meat Snack, Individually Wrapped, 8g Protein, 90 Calories, Gluten Free - 1oz (12ct Pouch)",https://m.media-amazon.com/images/I/71wotx4eTqL._SL1500_.jpg,"ivory, bar, soap, free, dyes, heavy, perfumes, reflects, 140, years, experience, creating, gentle, products, family, trust, ivory, bar, soap, original, scent, oz, 10, count, safe, pure, clean, trusted, generations, dermatologist, tested, free, dyes, heavy, perfumes, pure, floats","personal, care, bath, body, bar, soap, ivory, ivory, bar, soap, free, dyes, heavy, perfumes, reflects, 140, years, experience, creating, gentle, products, family, trust, ivory, bar, soap, original, scent, oz, 10, count, safe, pure, clean, trusted, generations, dermatologist, tested, free, dyes, heavy, perfumes, pure, floats"
391,401,964,6,0.0,0.0,"health, vitamins, supplements, supplements","klamath, blue, green, algae","Crystal Style Fashion Women's Beaded Lanyard 34"", Breakaway and Non breakaway available, For Keys, Badge holder (Black Crystal - NON Breakaway (Stronger))",https://m.media-amazon.com/images/I/71RFIUFlfKL._AC_SL1500_.jpg,"klamath, blue, green, algae, blue, green, algae, 400, mg, 130, tablet, upc, 735749400049upc, 735749400049, klamath, blue, green, algae, blue, green, algae, 400, mg, 130, tablet, upc, 735749400049, klamath, blue, green, algae, blue, green, algae, 400, mg, 130, tablet, upc, 735749400049, klamath, blue, green, algae, blue, green, algae, 400, mg, 130, tablet","health, vitamins, supplements, supplements, klamath, blue, green, algae, klamath, blue, green, algae, blue, green, algae, 400, mg, 130, tablet, upc, 735749400049upc, 735749400049, klamath, blue, green, algae, blue, green, algae, 400, mg, 130, tablet, upc, 735749400049, klamath, blue, green, algae, blue, green, algae, 400, mg, 130, tablet, upc, 735749400049, klamath, blue, green, algae, blue, green, algae, 400, mg, 130, tablet"
392,402,9,58,4.4,57.0,"premium, beauty, premium, makeup, premium, nail, polish, care, premium, nail, polish",opi,"Swingline Staples, Premium High Capacity for Desktop Staplers, 3/8"" Length, 125/Strip, 2500/Box, Jam Free, Optima (35550)",https://m.media-amazon.com/images/I/61BFTqAqDxL._AC_SL1080_.jpg,,"premium, beauty, premium, makeup, premium, nail, polish, care, premium, nail, polish, opi, "
393,404,7786,5,0.0,11478.0,"beauty, nail, care, nail, polish, nail, polish",essie,"EXPO Low Odor Dry Erase Markers, Chisel Tip, Assorted Colors, 8 Count",https://m.media-amazon.com/images/I/81AmlwOtNRL._AC_SL1500_.jpg,"35, years, essie, ultimate, color, authority, offering, line, superior, nail, polishes, trendsetting, shades, exclusive, award, winning, formula, classic, chic, sassy, elegant, essie, nail, polish, provides, flawless, streak, free, coverage, chip, resistant, formula, essie, nail, polishes, dbp, toluene, formaldehyde, free, essie, nail, polish, minimalistic, pink, sheer, nail, polish, fl, oz, provides, flawless, coverage, outstanding, durability, glossy, shine, matte, finishes, available, comes, extensive, palette, shades, cult, favorite, ballet, slippers, new, trendsetting, colors, add, essie, compliment, look","beauty, nail, care, nail, polish, nail, polish, essie, 35, years, essie, ultimate, color, authority, offering, line, superior, nail, polishes, trendsetting, shades, exclusive, award, winning, formula, classic, chic, sassy, elegant, essie, nail, polish, provides, flawless, streak, free, coverage, chip, resistant, formula, essie, nail, polishes, dbp, toluene, formaldehyde, free, essie, nail, polish, minimalistic, pink, sheer, nail, polish, fl, oz, provides, flawless, coverage, outstanding, durability, glossy, shine, matte, finishes, available, comes, extensive, palette, shades, cult, favorite, ballet, slippers, new, trendsetting, colors, add, essie, compliment, look"
394,405,49,829147,5.0,1.0,"premium, beauty, premium, bath, body, premium, body, lotions","tommy, bahama","EXPO Low Odor Dry Erase Marker Set with White Board Eraser and Cleaner, Fine Tip Dry Erase Markers, Assorted Colors, 7 Piece Set with Whiteboard Cleaner",https://m.media-amazon.com/images/I/81Vf27C9i6L._AC_SL1500_.jpg,,"premium, beauty, premium, bath, body, premium, body, lotions, tommy, bahama, "
395,406,91,9238128,4.8,4.0,"premium, beauty, premium, facial, skincare, premium, face, cleansers","la, roche, posay","EXPO Low Odor Dry Erase Marker Set with White Board Eraser and Cleaner, Fine Tip Dry Erase Markers, Assorted Colors, 7 Piece Set with Whiteboard Cleaner",https://m.media-amazon.com/images/I/81Vf27C9i6L._AC_SL1500_.jpg,,"premium, beauty, premium, facial, skincare, premium, face, cleansers, la, roche, posay, "
396,407,36,57,4.3,3.0,"personal, care, incontinence, incontinence, underwear",medline,"Kaytee Simple Sleeper Play Tunnel Pink, Purple, Blue, Green 15 Inches x 4.5 Inches",https://m.media-amazon.com/images/I/81p1O4dBkwL._AC_SL1500_.jpg,"dignity, comfort, protection, great, value, breathable, soft, non, woven, sheet, comfortable, skin, minimizing, risk, skin, irritation, heat, build, extra, absorbency, core, optimal, dryness, protection, body, contoured, anatomical, design, added, comfort, fit, feel, underwear, acquisition, dryness, layer, helps, moisture, away, skin, size, printed, sheet, improve, product, identification, ease, care, available, insizes, medium, 71, cm, 102, cm, large, 102, cm, 142, cm, x, large, 142, cm, 173, extra, protective, underwear, x, large","personal, care, incontinence, incontinence, underwear, medline, dignity, comfort, protection, great, value, breathable, soft, non, woven, sheet, comfortable, skin, minimizing, risk, skin, irritation, heat, build, extra, absorbency, core, optimal, dryness, protection, body, contoured, anatomical, design, added, comfort, fit, feel, underwear, acquisition, dryness, layer, helps, moisture, away, skin, size, printed, sheet, improve, product, identification, ease, care, available, insizes, medium, 71, cm, 102, cm, large, 102, cm, 142, cm, x, large, 142, cm, 173, extra, protective, underwear, x, large"
397,408,33034,5,0.0,0.0,"personal, care, bath, body, body, wash, shower, gel",attitude,"Oxford Plastic Index Card Box, 4 x 6 Inches, 400 Card Capacity, Black (01461)",https://m.media-amazon.com/images/I/61Jj-gn+JcL._AC_SL1500_.jpg,"attitude, natural, body, wash, soothing, ounce, sold, single, value, multi, packs, buy, quantity, save, 1763","personal, care, bath, body, body, wash, shower, gel, attitude, attitude, natural, body, wash, soothing, ounce, sold, single, value, multi, packs, buy, quantity, save, 1763"
398,409,79,0,0.0,0.0,"beauty, makeup, eye, makeup, eye, makeup, brands, maybelline, eye, makeup",maybelline,"Oxford Plastic Index Card Box, 4 x 6 Inches, 400 Card Capacity, Black (01461)",https://m.media-amazon.com/images/I/61Jj-gn+JcL._AC_SL1500_.jpg,"pack, 4, pack, 4, upc, 041554409321, double, shot, volumizing, mascara, brush, brush, scoops, extra, shot, plumping, collagen, formula, stroke, 12x, volume","beauty, makeup, eye, makeup, eye, makeup, brands, maybelline, eye, makeup, maybelline, pack, 4, pack, 4, upc, 041554409321, double, shot, volumizing, mascara, brush, brush, scoops, extra, shot, plumping, collagen, formula, stroke, 12x, volume"
399,410,4,-2147483648,4.5,247.0,"beauty, beauty, bath, body, deodorants, antiperspirants",schmidt,"Kaytee Simple Sleeper Play Tunnel Pink, Purple, Blue, Green 15 Inches x 4.5 Inches",https://m.media-amazon.com/images/I/81p1O4dBkwL._AC_SL1500_.jpg,"sensitive, skin, natural, deodorant, uses, innovative, ingredients, derived, plants, minerals, help, effectively, neutralize, odor, fresh, heard, natural, deodorants, work, deodorants, free, aluminum, salts, propylene, glycol, parabens, phthalates, contain, artificial, fragrances, coloring, schmidts, deodorants, plant, based, oils, butters, like, coconut, oil, jojoba, seed, oil, shea, butter, vitamin, e, smell, good, feel, good, certified, vegan, deodorants, certified, cruelty, free, jasmine, tea, gender, neutral, sensitive, skin, deodorant, delicate, sophisticated, floral, scent, keeping, smelling, fresh, feeling, great, jasmine, tea, sensitive, skin, deodorant, formula, uses, magnesium, known, gentle, skin, help, neutralize, odor, natural, refreshing, protection, non, greasy, non, sticky, feel, allows, deodorant, easily, absorbed, natural, deodorant, sticks, require, small, application, great, results, use, hold, product, momentarily, skin, soften, contact, body, heat, gently, apply, small, dry, clean, underarms, feeling, fresh, day, 1, 2, swipes, application, need, apply, irritated, damaged, skin, schmidts, natural, sensitive, deodorant, stick, jasmine, tea, oz, helps, neutralize, odor, fresh, free, baking, soda, free, aluminum, salts, propylene, glycol, parabens, phthalates, artificial, fragrance, luxurious, long, lasting, scent, natural, notes, jasmine, delicate, sophisticated, undertones, green, tea, non, greasy, non, sticky, feel, easily, absorbed, goes, smooth, condensed, formula, fillers, requires, small, results, apply, hold, product, momentarily, skin, soften, oils, contact, body, heat, gently, apply, small, underarms, 1, 2, swipes, enjoy, certified, vegan, cruelty, free","beauty, beauty, bath, body, deodorants, antiperspirants, schmidt, sensitive, skin, natural, deodorant, uses, innovative, ingredients, derived, plants, minerals, help, effectively, neutralize, odor, fresh, heard, natural, deodorants, work, deodorants, free, aluminum, salts, propylene, glycol, parabens, phthalates, contain, artificial, fragrances, coloring, schmidts, deodorants, plant, based, oils, butters, like, coconut, oil, jojoba, seed, oil, shea, butter, vitamin, e, smell, good, feel, good, certified, vegan, deodorants, certified, cruelty, free, jasmine, tea, gender, neutral, sensitive, skin, deodorant, delicate, sophisticated, floral, scent, keeping, smelling, fresh, feeling, great, jasmine, tea, sensitive, skin, deodorant, formula, uses, magnesium, known, gentle, skin, help, neutralize, odor, natural, refreshing, protection, non, greasy, non, sticky, feel, allows, deodorant, easily, absorbed, natural, deodorant, sticks, require, small, application, great, results, use, hold, product, momentarily, skin, soften, contact, body, heat, gently, apply, small, dry, clean, underarms, feeling, fresh, day, 1, 2, swipes, application, need, apply, irritated, damaged, skin, schmidts, natural, sensitive, deodorant, stick, jasmine, tea, oz, helps, neutralize, odor, fresh, free, baking, soda, free, aluminum, salts, propylene, glycol, parabens, phthalates, artificial, fragrance, luxurious, long, lasting, scent, natural, notes, jasmine, delicate, sophisticated, undertones, green, tea, non, greasy, non, sticky, feel, easily, absorbed, goes, smooth, condensed, formula, fillers, requires, small, results, apply, hold, product, momentarily, skin, soften, oils, contact, body, heat, gently, apply, small, underarms, 1, 2, swipes, enjoy, certified, vegan, cruelty, free"
