,Unnamed: 0,ID,ProdID,Rating,ReviewCount,Category,Brand,Name,ImageURL,Description,Tags
115,116,1,3,4.5,8.0,"personal, care, oral, care, toothbrushes, manual, toothbrushes, colgate, toothbrushes",colgate,"Smead Colored File Folder, 1/3-Cut Tab, Letter Size, Assorted Primary Colors, 100 per Box (11943)",https://m.media-amazon.com/images/I/71YnVN9UC9L._AC_SL1500_.jpg,"oral, b, pulsar, gum, care, battery, operated, toothbrush, vibrating, bristles, gently, massage, stimulate, gums, remove, plaque, technique, brush, manual, toothbrush, micro, pulse, bristles, pivot, pulse, penetrate, deep, teeth, pulsar, shown, reduce, gingivitis, improve, gum, health, promoting, healthier, firmer, gums, easy, use, regular, manual, toothbrush, oral, b, brand, dentists, use, worldwide, oral, b, pulsar, gum, care, battery, powered, toothbrush, soft, 1, count, vibrating, bristles, gently, massage, stimulate, gums, shown, reduce, gingivitis, improve, gum, health, promotes, healthier, firmer, gums, micro, pulse, bristles, pivot, pulse, penetrate, deep, teeth, provide, truly, superior, clean, vs, regular, manual, brush, battery, operated, battery, included, oral, b, 1, dentist, recommended, toothbrush, brand, worldwide","personal, care, oral, care, toothbrushes, manual, toothbrushes, colgate, toothbrushes, colgate, oral, b, pulsar, gum, care, battery, operated, toothbrush, vibrating, bristles, gently, massage, stimulate, gums, remove, plaque, technique, brush, manual, toothbrush, micro, pulse, bristles, pivot, pulse, penetrate, deep, teeth, pulsar, shown, reduce, gingivitis, improve, gum, health, promoting, healthier, firmer, gums, easy, use, regular, manual, toothbrush, oral, b, brand, dentists, use, worldwide, oral, b, pulsar, gum, care, battery, powered, toothbrush, soft, 1, count, vibrating, bristles, gently, massage, stimulate, gums, shown, reduce, gingivitis, improve, gum, health, promotes, healthier, firmer, gums, micro, pulse, bristles, pivot, pulse, penetrate, deep, teeth, provide, truly, superior, clean, vs, regular, manual, brush, battery, operated, battery, included, oral, b, 1, dentist, recommended, toothbrush, brand, worldwide"
116,117,55653,2,0.0,0.0,"personal, care, sun, care, sunscreen",coppertone,"Kaytee All Natural Timothy Hay for Guinea Pigs, Rabbits & Other Small Animals, 12 Pound",https://m.media-amazon.com/images/I/81xPQyhCSSL._AC_SL1500_.jpg,"pack, 3, upc, 041100004185, heading, purpose, sunscreen, manufacturer, msd, consumer, active, ingredients, avobenzone, 3, homosalate, 13, octisalate, 5, octocrylene, 5, oxybenzone, 6, directions, apply, liberally, 15, minutes, sun, exposure, reapply, 80, minutes, swimming, sweating, immediately, towel, drying, 2, hours, sun, protection, measures, spending, time, sun, increases, risk, skin, cancer, early, skin, aging, decrease, risk, regularly, use, sunscreen, broad, spectrum, spf, value, 15, higher, sun, protection, measures, including, limit, time, sun, especially, 10, 2, wear, long, sleeve, shirts, pants, hats, sunglasses, children, 6, months, ask, doctor, protect, product, excessive, heat, direct, sun, inactive, ingredients, water, styrene, acrylates, copolymer, propylene, glycol, neopentyl, glycol, diheptanoate, bis, stearyl, ethylenediamine, neopentyl, glycol, stearyl, hydrogenated, dimer, dilinoleate, copolymer, benzyl, alcohol, diethylhexyl, syringylidenemalonate, tocopherol, vitamin, e, sodium, ascorbyl, phosphate, retinyl, palmitate, vitamin, triethanolamine, chlorphenesin, fragrance, acrylates, c10, 30, alkyl, acrylate, crosspolymer, caprylic, capric, triglyceride, disodium, edta, uses, helps, prevent, sunburn, directed, sun, protection, measures, directions, decreases, risk, skin, cancer, early, skin, aging, caused, sun, stays, strong, sweat, wo, nt, run, eyes, sting, plus, antioxidant, defense, water, resistant, 80, minutes, warnings, external, use, use, damaged, broken, skin, product, eyes, rinse, water, remove, stop, use, ask, doctor, rash, occurs, reach, children, product, swallowed, medical, help, contact, poison, control, center, right, away, stain, damage, fabrics, surfaces, hide","personal, care, sun, care, sunscreen, coppertone, pack, 3, upc, 041100004185, heading, purpose, sunscreen, manufacturer, msd, consumer, active, ingredients, avobenzone, 3, homosalate, 13, octisalate, 5, octocrylene, 5, oxybenzone, 6, directions, apply, liberally, 15, minutes, sun, exposure, reapply, 80, minutes, swimming, sweating, immediately, towel, drying, 2, hours, sun, protection, measures, spending, time, sun, increases, risk, skin, cancer, early, skin, aging, decrease, risk, regularly, use, sunscreen, broad, spectrum, spf, value, 15, higher, sun, protection, measures, including, limit, time, sun, especially, 10, 2, wear, long, sleeve, shirts, pants, hats, sunglasses, children, 6, months, ask, doctor, protect, product, excessive, heat, direct, sun, inactive, ingredients, water, styrene, acrylates, copolymer, propylene, glycol, neopentyl, glycol, diheptanoate, bis, stearyl, ethylenediamine, neopentyl, glycol, stearyl, hydrogenated, dimer, dilinoleate, copolymer, benzyl, alcohol, diethylhexyl, syringylidenemalonate, tocopherol, vitamin, e, sodium, ascorbyl, phosphate, retinyl, palmitate, vitamin, triethanolamine, chlorphenesin, fragrance, acrylates, c10, 30, alkyl, acrylate, crosspolymer, caprylic, capric, triglyceride, disodium, edta, uses, helps, prevent, sunburn, directed, sun, protection, measures, directions, decreases, risk, skin, cancer, early, skin, aging, caused, sun, stays, strong, sweat, wo, nt, run, eyes, sting, plus, antioxidant, defense, water, resistant, 80, minutes, warnings, external, use, use, damaged, broken, skin, product, eyes, rinse, water, remove, stop, use, ask, doctor, rash, occurs, reach, children, product, swallowed, medical, help, contact, poison, control, center, right, away, stain, damage, fabrics, surfaces, hide"
117,118,-2147483648,831,2.8,1769.0,"beauty, hair, care, hair, care, brands, hair, care",paris,"Prismacolor Premier Colored Pencils, Soft Core, 48 Pack",https://m.media-amazon.com/images/I/91X+M91eP3L._AC_SL1500_.jpg,"loreal, paris, colorista, semi, permanent, brunette, hair, maroon, semi, permanent, color, maroon, 22, 4, fl, oz, 118, ml, new, medium, brown, light, brown, hair, lasts, approximately, 5, 10, shampoos, ammonia, peroxide, vegan, rules, color, fades, shampoo, shampoo, wear, work, wash, colorista, semi, permanent, created, pure, direct, dyes, conditioning, hair, mask, mixing, required, ammonia, peroxide, vegan, formula, animal, derived, ingredients, byproducts, wash, lasts, approx, 7, 15, shampoos, lastingness, shorter, longer, 7, 15, shampoos, depending, starting, color, condition, hair, color, fades, gradually, shampoo, shampoo, stunning, reflects, lighter, brunette, visible, color, results, color, medium, brown, light, brown, hair, product, tint, color, add, stunning, reflects, hair, use, natural, blonde, bleached, blonde, results, vary, depending, starting, color, condition, hair, recommended, predominantly, gray, hair, kit, color, tube, gloves, instruction, sheet, expert, brush, read, follow, insert, talk, colorista, specialist, toll, free, 1, 800, 631, 7358, visit, mexico","beauty, hair, care, hair, care, brands, hair, care, paris, loreal, paris, colorista, semi, permanent, brunette, hair, maroon, semi, permanent, color, maroon, 22, 4, fl, oz, 118, ml, new, medium, brown, light, brown, hair, lasts, approximately, 5, 10, shampoos, ammonia, peroxide, vegan, rules, color, fades, shampoo, shampoo, wear, work, wash, colorista, semi, permanent, created, pure, direct, dyes, conditioning, hair, mask, mixing, required, ammonia, peroxide, vegan, formula, animal, derived, ingredients, byproducts, wash, lasts, approx, 7, 15, shampoos, lastingness, shorter, longer, 7, 15, shampoos, depending, starting, color, condition, hair, color, fades, gradually, shampoo, shampoo, stunning, reflects, lighter, brunette, visible, color, results, color, medium, brown, light, brown, hair, product, tint, color, add, stunning, reflects, hair, use, natural, blonde, bleached, blonde, results, vary, depending, starting, color, condition, hair, recommended, predominantly, gray, hair, kit, color, tube, gloves, instruction, sheet, expert, brush, read, follow, insert, talk, colorista, specialist, toll, free, 1, 800, 631, 7358, visit, mexico"
118,119,73,5,4.6,630.0,"beauty, beauty, brands, milani, milani, lipstick",milani,"Halo 100% Chicken Breast Freeze-Dried Raw Treats, 2.2 oz.",https://m.media-amazon.com/images/I/716LV-kfkDL._AC_SL1500_.jpg,"enhance, look, milani, color, statement, lipstick, features, lightweight, formula, designed, smooth, stroke, application, paraben, free, lipstick, contains, vitamins, c, e, promote, skin, health, milani, color, statement, lipstick, sweet, nectar, true, instant, color, lipstick, 1, stroke, coverage, application, lightweight, cream, formula, contains, vitamins, c, e, moisturize, nourish, lips, paraben, free, formula, milani, statement, lipstick, shade, sweet, nectar","beauty, beauty, brands, milani, milani, lipstick, milani, enhance, look, milani, color, statement, lipstick, features, lightweight, formula, designed, smooth, stroke, application, paraben, free, lipstick, contains, vitamins, c, e, promote, skin, health, milani, color, statement, lipstick, sweet, nectar, true, instant, color, lipstick, 1, stroke, coverage, application, lightweight, cream, formula, contains, vitamins, c, e, moisturize, nourish, lips, paraben, free, formula, milani, statement, lipstick, shade, sweet, nectar"
119,120,490,443,0.0,447.0,"personal, care, deodorants, antiperspirants","old, spice","Prismacolor Premier Colored Pencils, Soft Core, 48 Pack",https://m.media-amazon.com/images/I/91X+M91eP3L._AC_SL1500_.jpg,"know, stepped, shower, clinched, deals, told, jokes, dated, ladies, got, shower, kind, smell, old, spice, science, mensomehow, figured, bottle, manly, anti, perspirant, deodorant, apply, thatsweat, crushing, achieving, science, man, body, lady, body, judging, stronger, longer, lasting, sweat, protection, red, collection, anti, perspirant, deodorant, old, spice, sweat, defense, extra, strong, mens, anti, perspirant, deodorant, keeps, smelling, extra, manly, old, spice, antiperspirant, deodorant, sweat, defense, stronger, swagger, oz, stronger, longer, lasting, sweat, protection, red, collection, anti, perspirant, deodorant, old, spice, sweat, defense, extra, strong, mens, anti, perspirant, deodorant, keeps, smelling, extra, manly, hardest, working, collection, brings, odor, blocking, sweat, defending, dirt, destroying, power, stronger, swagger, helps, embrace, swagger, stronger, swagger, legendary, protection, legendary, men, old, spice, hardest, working, collection, sweat, defense, anti, perspirant, deodorant, stronger, swagger, scent","personal, care, deodorants, antiperspirants, old, spice, know, stepped, shower, clinched, deals, told, jokes, dated, ladies, got, shower, kind, smell, old, spice, science, mensomehow, figured, bottle, manly, anti, perspirant, deodorant, apply, thatsweat, crushing, achieving, science, man, body, lady, body, judging, stronger, longer, lasting, sweat, protection, red, collection, anti, perspirant, deodorant, old, spice, sweat, defense, extra, strong, mens, anti, perspirant, deodorant, keeps, smelling, extra, manly, old, spice, antiperspirant, deodorant, sweat, defense, stronger, swagger, oz, stronger, longer, lasting, sweat, protection, red, collection, anti, perspirant, deodorant, old, spice, sweat, defense, extra, strong, mens, anti, perspirant, deodorant, keeps, smelling, extra, manly, hardest, working, collection, brings, odor, blocking, sweat, defending, dirt, destroying, power, stronger, swagger, helps, embrace, swagger, stronger, swagger, legendary, protection, legendary, men, old, spice, hardest, working, collection, sweat, defense, anti, perspirant, deodorant, stronger, swagger, scent"
120,121,7,106,5.0,3.0,"personal, care, bath, body, body, lotions, creams","alba, botanica","Master Airbrush Hobby Airbrush Spray Booth Filter Set, Fits Master, Paasche, Sky Enterprise, Airhobby and Many Others. (Pack of 4)",https://m.media-amazon.com/images/I/8172lioC+BL._AC_SL1500_.jpg,"moisturize, nourish, sensitive, skin, alba, botanica, emollient, herbal, healing, lotion, colloidal, oatmeal, rich, lotion, soothes, calms, inflamed, damaged, skin, botanical, extracts, aloe, bamboo, cannabis, oil, turmeric, provide, therapeutic, repairing, care, dry, skin, 100, vegetarian, formula, hypo, allergenic, contain, parabens, phthalates, synthetic, fragrances, tested, animals, includes, 32, oz, bottle, alba, botanica, emollient, herbal, healing, lotion, alba, botanica, product, family, constantly, evolves, alongside, health, beauty, ingredient, knowledge, trends, dedicated, making, high, quality, 100, vegetarian, products, overflow, botanical, ingredients, beautiful, s, motto, motivates, body, loving, products, nourish, skin, hair, course, soul, 32, oz, bottle, alba, botanica, emollient, herbal, healing, lotion, provides, therapeutic, repairing, care, sensitive, skin, nourishing, colloidal, oatmeal, helps, calm, inflammation, discomfort, botanicals, aloe, bamboo, cannabis, oil, turmeric, parabens, phthalates, synthetic, fragrances","personal, care, bath, body, body, lotions, creams, alba, botanica, moisturize, nourish, sensitive, skin, alba, botanica, emollient, herbal, healing, lotion, colloidal, oatmeal, rich, lotion, soothes, calms, inflamed, damaged, skin, botanical, extracts, aloe, bamboo, cannabis, oil, turmeric, provide, therapeutic, repairing, care, dry, skin, 100, vegetarian, formula, hypo, allergenic, contain, parabens, phthalates, synthetic, fragrances, tested, animals, includes, 32, oz, bottle, alba, botanica, emollient, herbal, healing, lotion, alba, botanica, product, family, constantly, evolves, alongside, health, beauty, ingredient, knowledge, trends, dedicated, making, high, quality, 100, vegetarian, products, overflow, botanical, ingredients, beautiful, s, motto, motivates, body, loving, products, nourish, skin, hair, course, soul, 32, oz, bottle, alba, botanica, emollient, herbal, healing, lotion, provides, therapeutic, repairing, care, sensitive, skin, nourishing, colloidal, oatmeal, helps, calm, inflammation, discomfort, botanicals, aloe, bamboo, cannabis, oil, turmeric, parabens, phthalates, synthetic, fragrances"
121,122,31,5148,3.2,26.0,"personal, care, oral, care, dental, floss, dental, floss","oral, b","Torani Vanilla Syrup 12.7 Ounce, 4 Count",https://m.media-amazon.com/images/I/91k8bd-Rk8L._SL1500_.jpg,"oral, b, pro, health, deep, clean, floss, cool, mint","personal, care, oral, care, dental, floss, dental, floss, oral, b, oral, b, pro, health, deep, clean, floss, cool, mint"
122,123,306,373299,0.0,47.0,"baby, health, safety, baby, bath, baby, shampoos, body, washes",aveeno,"Torani Vanilla Syrup 12.7 Ounce, 4 Count",https://m.media-amazon.com/images/I/91k8bd-Rk8L._SL1500_.jpg,"free, shipping, pack, 2, pack, 2, upc, 381370042495, aveeno, brand, dermatologist, recommended, nearly, years, active, ingredients, water, cocamidopropyl, betaine, glycerin, sorbitan, laurate, sodium, trideceth, sulfate, acrylates, copolymer, avena, sativa, oat, kernel, flour, sodium, benzoate, styrene, acrylates, copolymer, mineral, oil, tetrasodium, edta, m, benzaldehyde, contain, sodium, hydroxide, citric, acid, uses, aveeno, baby, soothing, relief, creamy, wash, specially, formulated, natural, colloidal, oatmeal, rich, emollients, blended, creamy, wash, gently, cleanses, soothe, relieve, dry, skin, dry, skin, eczema, daily, routine, aveeno, baby, soothing, relief, moisture, cream, tear, free, wash, leaves, skin, feeling, moisturized, 24, hours, babys, skin, looks, feels, healthier, fragrance, free, hypoallergenic, gentle, sensitive, baby, skin","baby, health, safety, baby, bath, baby, shampoos, body, washes, aveeno, free, shipping, pack, 2, pack, 2, upc, 381370042495, aveeno, brand, dermatologist, recommended, nearly, years, active, ingredients, water, cocamidopropyl, betaine, glycerin, sorbitan, laurate, sodium, trideceth, sulfate, acrylates, copolymer, avena, sativa, oat, kernel, flour, sodium, benzoate, styrene, acrylates, copolymer, mineral, oil, tetrasodium, edta, m, benzaldehyde, contain, sodium, hydroxide, citric, acid, uses, aveeno, baby, soothing, relief, creamy, wash, specially, formulated, natural, colloidal, oatmeal, rich, emollients, blended, creamy, wash, gently, cleanses, soothe, relieve, dry, skin, dry, skin, eczema, daily, routine, aveeno, baby, soothing, relief, moisture, cream, tear, free, wash, leaves, skin, feeling, moisturized, 24, hours, babys, skin, looks, feels, healthier, fragrance, free, hypoallergenic, gentle, sensitive, baby, skin"
123,124,2,1,4.6,343.0,,gain,"Equal Exchange Organic Whole Bean Coffee, Mind Body Soul, 12-Ounce Bag",https://m.media-amazon.com/images/I/61-yiWCVS-L._SL1000_.jpg,"light, delightful, scent, gain, flings, moonlight, breeze, scented, liquid, laundry, detergent, pacs, nose, feel, like, paradise, oxi, boost, stain, fighters, odor, elimination, febreze, ll, bring, breath, fresh, moonlit, air, laundry, room, 3, detergent, oxi, boost, febreze, freshness, 6, weeks, freshness, wash, wear, 50, scent, gain, liquid, laundry, detergent, gain, flings, moonlight, breeze, 42, ct, laundry, detergent, pacs, 3, detergent, oxi, boost, febreze, freshness, 6, weeks, freshness, wash, wear, 50, scent, gain, liquid, laundry, detergent, works, washing, machines, cold, water, reach, children, like, household, detergent, away, children",", gain, light, delightful, scent, gain, flings, moonlight, breeze, scented, liquid, laundry, detergent, pacs, nose, feel, like, paradise, oxi, boost, stain, fighters, odor, elimination, febreze, ll, bring, breath, fresh, moonlit, air, laundry, room, 3, detergent, oxi, boost, febreze, freshness, 6, weeks, freshness, wash, wear, 50, scent, gain, liquid, laundry, detergent, gain, flings, moonlight, breeze, 42, ct, laundry, detergent, pacs, 3, detergent, oxi, boost, febreze, freshness, 6, weeks, freshness, wash, wear, 50, scent, gain, liquid, laundry, detergent, works, washing, machines, cold, water, reach, children, like, household, detergent, away, children"
124,125,99,46187,0.0,1272.0,"beauty, beauty, brands, nyx, professional, makeup, nyx, professional, lip, makeup","nyx, professional, makeup",Mint Aran Dog Sweater Size #12 Medium,https://m.media-amazon.com/images/I/71ZAKaCzS1L._AC_SL1500_.jpg,"available, 10, trendy, tones, super, iconic, nyx, professional, makeup, butter, gloss, silky, smooth, satisfying, hot, pink, lilac, peachy, nude, modern, newbies, inspired, things, los, angeles, glistening, glossy, shade, serves, sheer, medium, coverage, melts, lips, non, tacky, leaving, lips, soft, supple, kissable, lips, melting, fan, fave, glosses, deliver, dash, glistening, color, glossy, lips, sticky, sensation, butter, lip, gloss, works, soften, condition, lips, giving, hint, color, gloss, turn, hydration, soothing, lip, moisturizer, lips, look, plump, shimmery, simply, swipe, smack, gorgeous, glossy, lips, perfect, sweet, tooth, nyx, professional, makeup, products, proudly, cruelty, free, peta, certified, bestselling, lip, gloss, 10, new, shades, bit, honey, sorbet, orangesicle, summer, fruit, rocky, road, apple, crisp, cranberry, pie, cinnamon, roll, marshmallow, blueberry, tart, comfortable, non, tacky, feel, sheer, medium, coverage, glides, silky, smooth, softens, conditions, lips, giving, hint, color, gloss, cruelty, free","beauty, beauty, brands, nyx, professional, makeup, nyx, professional, lip, makeup, nyx, professional, makeup, available, 10, trendy, tones, super, iconic, nyx, professional, makeup, butter, gloss, silky, smooth, satisfying, hot, pink, lilac, peachy, nude, modern, newbies, inspired, things, los, angeles, glistening, glossy, shade, serves, sheer, medium, coverage, melts, lips, non, tacky, leaving, lips, soft, supple, kissable, lips, melting, fan, fave, glosses, deliver, dash, glistening, color, glossy, lips, sticky, sensation, butter, lip, gloss, works, soften, condition, lips, giving, hint, color, gloss, turn, hydration, soothing, lip, moisturizer, lips, look, plump, shimmery, simply, swipe, smack, gorgeous, glossy, lips, perfect, sweet, tooth, nyx, professional, makeup, products, proudly, cruelty, free, peta, certified, bestselling, lip, gloss, 10, new, shades, bit, honey, sorbet, orangesicle, summer, fruit, rocky, road, apple, crisp, cranberry, pie, cinnamon, roll, marshmallow, blueberry, tart, comfortable, non, tacky, feel, sheer, medium, coverage, glides, silky, smooth, softens, conditions, lips, giving, hint, color, gloss, cruelty, free"
125,126,3,3498,0.0,0.0,"beauty, hair, care, hair, styling, products, hair, pomade",dax,Huawei Mate 8 Heavy Duty Case 2 in 1 Hybrid Shockproof Hard Back Case Cover for Huawei Mate 8 6.0inches (Marsala Red),https://m.media-amazon.com/images/I/61zYentvSjL._AC_SL1001_.jpg,"free, shipping, pack, 2, pack, 2, upc, 077315003019, quality, hair, care, products, active, ingredients, petrolatum, lanolin, olive, oil, castor, oil, coconut, oil, mineral, oil, yellow, 11, green, 6, stearic, acid, parfum, uses, recommended, hair, breaks, ends, excessive, dryness","beauty, hair, care, hair, styling, products, hair, pomade, dax, free, shipping, pack, 2, pack, 2, upc, 077315003019, quality, hair, care, products, active, ingredients, petrolatum, lanolin, olive, oil, castor, oil, coconut, oil, mineral, oil, yellow, 11, green, 6, stearic, acid, parfum, uses, recommended, hair, breaks, ends, excessive, dryness"
126,127,0,3,4.0,461.0,"beauty, beauty, brands, makeup",paris,"Idepet 1SET Dog Muzzles Suit,7PCS Adjustable Dog Cover Anti-Biting Barking Muzzles for Small Medium Large Extra Dog (Pink,Pack of 7)",https://m.media-amazon.com/images/I/71hu0X-NpXL._AC_SL1500_.jpg,"introducing, loreal, pro, 2, step, lipstick, long, lasting, transfer, proof, lipstick, ve, searching, fading, bleeding, high, intensity, lip, color, glides, moisturizing, feel, lasts, 24, hours, result, bold, moisturizing, lip, color, need, apply, stays, 24, hours, lipstick, high, intensity, color, pro, look, longwear, stays, 24hr, transfer, resistant","beauty, beauty, brands, makeup, paris, introducing, loreal, pro, 2, step, lipstick, long, lasting, transfer, proof, lipstick, ve, searching, fading, bleeding, high, intensity, lip, color, glides, moisturizing, feel, lasts, 24, hours, result, bold, moisturizing, lip, color, need, apply, stays, 24, hours, lipstick, high, intensity, color, pro, look, longwear, stays, 24hr, transfer, resistant"
127,128,17,28,0.0,0.0,"food, fresh, food, produce, nuts, dried, fruits, healthy, snacks, dried, fruits, vegetables","navitas, organics","API VACATION PYRAMID FISH FEEDER 14-Day 1.2-Ounce Automatic Fish Feeder, Whites & Tans",https://m.media-amazon.com/images/I/71cQhB7ldVL._AC_SL1500_.jpg,"health, boosting, plants, world, promise, superfoods, organic, nutrient, dense, handled, care, step, bpa, free","food, fresh, food, produce, nuts, dried, fruits, healthy, snacks, dried, fruits, vegetables, navitas, organics, health, boosting, plants, world, promise, superfoods, organic, nutrient, dense, handled, care, step, bpa, free"
128,129,826,4,4.3,6.0,"seasonal, school, morning, routine, essentials, children, hair, care",grisi,"API VACATION PYRAMID FISH FEEDER 14-Day 1.2-Ounce Automatic Fish Feeder, Whites & Tans",https://m.media-amazon.com/images/I/71cQhB7ldVL._AC_SL1500_.jpg,"manzanilla, kids, grisi, hair, lotion, ideal, hair, product, lightening, chamomile, enriched, formula, helps, lighten, damaging, hair, lightening, grisi, fairly, quick, rinse, lotion, works, day, long, detangling, lotion, fo","seasonal, school, morning, routine, essentials, children, hair, care, grisi, manzanilla, kids, grisi, hair, lotion, ideal, hair, product, lightening, chamomile, enriched, formula, helps, lighten, damaging, hair, lightening, grisi, fairly, quick, rinse, lotion, works, day, long, detangling, lotion, fo"
129,130,9,5,0.0,3954.0,"beauty, hair, care, hair, color, permanent, hair, color",garnier,"Gourmet Jellies & Jam Gift Set, Assorted Low Sugar Jam & Jellies, Jam & Jelly Gift Sets, Jams, Jellies & Preserves (12 pack) - Smoke Camp Crafts",https://m.media-amazon.com/images/I/71qdGh5e0nL._SL1500_.jpg,"garnier, nutrisse, hair, color, creme, nourishes, color, avocado, olive, shea, oils, nourishing, color, creme, enriched, fruit, oil, concentrate, penetrates, deep, hair, fibers, nourish, condition, hair, takes, color, better, holds, longer, root, tip, garnier, nutrisse, delivers, rich, radiant, long, lasting, hair, color, 100, grey, coverage, packaging, vary, garnier, nutrisse, nourishing, hair, color, creme, 12, natural, blue, black, 1, kit, permanent, nourishing, hair, color, creme, fruit, avocado, olive, shea, hair, color, creme, separate, ampoule, grape, seed, oil, start, nourishing, color, rich, radiant, long, lasting, color, 100, percent, grey, coverage, available, 45, nourishing, shades","beauty, hair, care, hair, color, permanent, hair, color, garnier, garnier, nutrisse, hair, color, creme, nourishes, color, avocado, olive, shea, oils, nourishing, color, creme, enriched, fruit, oil, concentrate, penetrates, deep, hair, fibers, nourish, condition, hair, takes, color, better, holds, longer, root, tip, garnier, nutrisse, delivers, rich, radiant, long, lasting, hair, color, 100, grey, coverage, packaging, vary, garnier, nutrisse, nourishing, hair, color, creme, 12, natural, blue, black, 1, kit, permanent, nourishing, hair, color, creme, fruit, avocado, olive, shea, hair, color, creme, separate, ampoule, grape, seed, oil, start, nourishing, color, rich, radiant, long, lasting, color, 100, percent, grey, coverage, available, 45, nourishing, shades"
